label,concept,2024-12-31,2023-12-31,2022-12-31,2021-12-31,2020-12-31,2019-12-31
Profit or Loss,us-gaap_ProfitLoss,215586000.0,46887000.0,-89885000.0,-56240000.0,-22867000.0,-16659000.0
Provision for transaction losses,us-gaap_ProvisionForLoanLeaseAndOtherLosses,5505000.0,8673000.0,23306000.0,5178000.0,2919000.0,3118000.0
Depreciation and amortization,us-gaap_DepreciationDepletionAndAmortization,-14813000.0,9449000.0,8057000.0,10261000.0,10172000.0,6661000.0
Amortization of debt issuance costs,us-gaap_AmortizationOfFinancingCosts,1842000.0,2098000.0,2961000.0,1182000.0,61000.0,52000.0
"Accretion of discount on purchases of marketable securities, net",us-gaap_AccretionAmortizationOfDiscountsAndPremiumsInvestments,-11911000.0,,,,,
Amortization of operating lease asset,us-gaap_OperatingLeaseRightOfUseAssetAmortizationExpense,2837000.0,3269000.0,3079000.0,3545000.0,3860000.0,3945000.0
Tides Foundation common stock warrant expense,upwk_IncreaseDecreaseInCommonStockWarrant,750000.0,750000.0,750000.0,750000.0,750000.0,711000.0
Stock-based compensation expense,us-gaap_ShareBasedCompensation,68391000.0,74195000.0,75501000.0,53592000.0,25508000.0,18798000.0
Deferred taxes,us-gaap_DeferredIncomeTaxExpenseBenefit,-129258000.0,,,,,
Gain on early extinguishment of convertible senior notes,us-gaap_GainsLossesOnExtinguishmentOfDebt,0.0,,,,,
Trade and client receivables,us-gaap_IncreaseDecreaseInAccountsReceivable,-4802000.0,-47663000.0,-20230000.0,-24610000.0,-20000000.0,-10918000.0
Prepaid expenses and other assets,us-gaap_IncreaseDecreaseInPrepaidDeferredExpenseAndOtherAssets,-656000.0,146000.0,-630000.0,-6960000.0,-1198000.0,-2069000.0
Operating lease liability,upwk_IncreaseDecreaseOperatingLeaseLiability,-4351000.0,-5903000.0,-5389000.0,-1163000.0,-1851000.0,-1453000.0
Accounts payable,us-gaap_IncreaseDecreaseInAccountsPayable,969000.0,-2513000.0,2579000.0,-1445000.0,5822000.0,-1457000.0
Accrued expenses and other liabilities,us-gaap_IncreaseDecreaseInAccruedLiabilitiesAndOtherOperatingLiabilities,4730000.0,5746000.0,3689000.0,10253000.0,15438000.0,-2957000.0
Deferred revenue,us-gaap_IncreaseDecreaseInDeferredRevenue,-10882000.0,-14538000.0,4257000.0,7454000.0,4027000.0,4430000.0
Net Cash from Operating Activities,us-gaap_NetCashProvidedByUsedInOperatingActivities,153563000.0,27221000.0,6559000.0,10836000.0,22365000.0,1058000.0
Purchases of marketable securities,us-gaap_PaymentsToAcquireAvailableForSaleSecuritiesDebt,-362322000.0,-709214000.0,-581887000.0,-525343000.0,-107281000.0,-168786000.0
"Proceeds from Maturities, Prepayments and Calls of Securities",us-gaap_ProceedsFromMaturitiesPrepaymentsAndCallsOfAvailableForSaleSecurities,486892000.0,648800000.0,,,,
"Proceeds from Sale of Debt Securities, ",us-gaap_ProceedsFromSaleOfAvailableForSaleSecuritiesDebt,41775000.0,165035000.0,,,,
Purchase of an intangible asset,us-gaap_PaymentsToAcquireIntangibleAssets,-0.0,-3000000.0,,,,
Payments to Acquire Businesses,us-gaap_PaymentsToAcquireBusinessesNetOfCashAcquired,-14333000.0,,,,,
"Payments for Property, Plant and Equipment",us-gaap_PaymentsToAcquirePropertyPlantAndEquipment,-3528000.0,-692000.0,-1248000.0,-1027000.0,-6320000.0,-10752000.0
Internal-use software and platform development costs,us-gaap_PaymentsToDevelopSoftware,-10916000.0,-12659000.0,-7485000.0,-5110000.0,-8045000.0,-5886000.0
Net Cash from Investing Activities,us-gaap_NetCashProvidedByUsedInInvestingActivities,137568000.0,88270000.0,-69468000.0,-428980000.0,-4146000.0,-100924000.0
"Changes in escrow funds payable, net",upwk_ChangesInEscrowFundsPayableNet,9956000.0,,,,,
Proceeds from exercises of stock options and common stock warrant,upwk_ProceedsFromExercisesOfStockOptionsAndCommonStockWarrants,3293000.0,2012000.0,1643000.0,7177000.0,31028000.0,18155000.0
Proceeds from employee stock purchase plan,us-gaap_ProceedsFromStockPlans,4795000.0,4081000.0,3794000.0,4789000.0,4913000.0,6391000.0
Net cash paid for early extinguishment of convertible senior notes,us-gaap_PaymentsOfDebtExtinguishmentCosts,-0.0,,,,,
Repurchase of common stock,us-gaap_PaymentsForRepurchaseOfCommonStock,-100000000.0,,,,,
Net Cash from Financing Activities,us-gaap_NetCashProvidedByUsedInFinancingActivities,-81956000.0,-114304000.0,6082000.0,537739000.0,54641000.0,29402000.0
Net Change in Cash,us-gaap_CashCashEquivalentsRestrictedCashAndRestrictedCashEquivalentsPeriodIncreaseDecreaseIncludingExchangeRateEffect,209175000.0,1187000.0,-56827000.0,119595000.0,72860000.0,-70464000.0
Cash paid for income taxes,us-gaap_IncomeTaxesPaid,4590000.0,1982000.0,,,,42000.0
Cash paid for interest,us-gaap_InterestPaidNet,920000.0,1321000.0,1541000.0,373000.0,764000.0,1291000.0
Payment of debt issuance costs,us-gaap_PaymentsOfDebtIssuanceCosts,,-0.0,-0.0,-14855000.0,,-0.0
Proceeds from issuance of convertible senior notes,us-gaap_ProceedsFromConvertibleDebt,,0.0,0.0,575000000.0,,
Purchases of capped calls related to convertible senior notes,upwk_PaymentsForPurchaseOfCappedCallsOnConvertibleNotes,,-0.0,-0.0,-49393000.0,,
Repayment of debt,us-gaap_RepaymentsOfDebt,,-0.0,-0.0,-10750000.0,-25621000.0,-55679000.0
Changes in escrow funds payable,upwk_ChangesInEscrowFundsPayable,,50930000.0,645000.0,25771000.0,26321000.0,10535000.0
Net cash paid for early extinguishment of debt,us-gaap_PaymentsOfDebtExtinguishmentCosts,,-171327000.0,,,,
Right-of-use asset recognized,us-gaap_RightOfUseAssetObtainedInExchangeForOperatingLeaseLiability,4436000.0,,,,,
Property and equipment purchased but not yet paid,us-gaap_CapitalExpendituresIncurredButNotYetPaid,26000.0,27000.0,0.0,22000.0,37000.0,161000.0
Internal-use software and platform development costs incurred but not yet paid,upwk_InternalUseSoftwareAndPlatformDevelopmentCostsIncurredButNotPaid,400000.0,215000.0,73000.0,106000.0,286000.0,684000.0
Impairment expense,us-gaap_AssetImpairmentCharges,,0.0,0.0,8741000.0,,
"Amortization of premium (accretion of discount) of purchases of marketable securities, net",us-gaap_AccretionAmortizationOfDiscountsAndPremiumsInvestments,,-14430000.0,-1486000.0,298000.0,,
Gain on early extinguishment of debt,us-gaap_GainsLossesOnExtinguishmentOfDebt,,-38945000.0,,,,
Loss on disposal of fixed assets,us-gaap_GainLossOnSaleOfPropertyPlantEquipment,,,-0.0,-0.0,44000.0,14000.0
Tax Withholding for Share-Based Compensation,us-gaap_PaymentsRelatedToTaxWithholdingForShareBasedCompensation,,,,,-0.0,-0.0
Proceeds from maturities of marketable securities,us-gaap_ProceedsFromSaleAndMaturityOfMarketableSecurities,,,521152000.0,102500000.0,117500000.0,84500000.0
Proceeds from borrowings on debt,us-gaap_ProceedsFromIssuanceOfDebt,,,0.0,0.0,18000000.0,50000000.0
Amortization of discount on purchases of marketable securities,us-gaap_AccretionAmortizationOfDiscountsAndPremiumsInvestments,,,,,-320000.0,-1158000.0
"Proceeds from the initial public offering, net of discounts and commissions",us-gaap_ProceedsFromIssuanceInitialPublicOffering,,,,,0.0,0.0
Payments of costs related to the initial public offering,upwk_PaymentsOfDeferredOfferingCosts,,,,,-0.0,-0.0
Repurchase of redeemable convertible preferred stock,us-gaap_PaymentsForRepurchaseOfRedeemableConvertiblePreferredStock,,,,,,-0.0
Proceeds from exercise of redeemable convertible preferred stock warrant,us-gaap_ProceedsFromIssuanceOfRedeemableConvertiblePreferredStock,,,,,,0.0
Unpaid deferred offering costs,upwk_DeferredOfferingCostsIncurredButNotYetPaid,,,,,,0.0
Change in fair value of redeemable convertible preferred stock warrant liability,upwk_ChangeInFairValueOfTemporaryEquity,,,,,0.0,0.0
Conversion of redeemable convertible preferred stock warrant in connection with the initial public offering,us-gaap_AdjustmentsToAdditionalPaidInCapitalWarrantIssued,,,,,0.0,0.0
Reclassification of redeemable convertible preferred stock warrant liability to redeemable convertible preferred stock,upwk_NoncashInvestingAndFinancingReclassificationOfRedeemableConvertiblePreferredStockWarrantLiabilityToRedeemableConvertiblePreferredStock,,,,,,0.0
Conversion of redeemable convertible preferred stock in connection with the initial public offering,us-gaap_TemporaryEquityEliminationAsPartofReorganization,,,,,0.0,0.0
